{
	"identifier": "core",
	"description": "",
	"local": true,
	"windows": ["main"],
	"permissions": [
		"core:default",
		"core:path:default",
		"core:event:default",
		"core:window:default",
		"core:app:default",
		"core:resources:default",
		"core:menu:default",
		"core:tray:default",
		"core:window:allow-create",
		"core:window:allow-maximize",
		"core:window:allow-toggle-maximize",
		"core:window:allow-unmaximize",
		"core:window:allow-minimize",
		"core:window:allow-unminimize",
		"core:window:allow-show",
		"core:window:allow-hide",
		"core:window:allow-close",
		"core:window:allow-set-decorations",
		"core:window:allow-start-dragging",
		"core:window:allow-start-resize-dragging",
		"core:webview:allow-set-webview-zoom"
	]
}
